{
  "schemaVersion": 1,
  "registryRevision": "13",
  "scoringPolicyVersion": "1.0.0",
  "promotionPolicyVersion": "1.1.0",
  "evaluationQueue": [
    {
      "position": 1,
      "actorId": "holoscript-snn-webgpu",
      "plannedHarnessIds": [
        "tropical-spmv",
        "lif-determinism"
      ]
    },
    {
      "position": 2,
      "actorId": "electronicarts-gigi",
      "plannedHarnessIds": [
        "generated-webgpu-suite"
      ]
    },
    {
      "position": 3,
      "actorId": "vercel-labs-vgpu",
      "plannedHarnessIds": [
        "node-ort-snapshot"
      ]
    },
    {
      "position": 4,
      "actorId": "umap-gpu",
      "plannedHarnessIds": [
        "sgd-output-correctness",
        "sgd-benchmark"
      ]
    },
    {
      "position": 5,
      "actorId": "world-lab-runtime-webgpu",
      "plannedHarnessIds": [
        "consumer-execution-oracles",
        "consumer-shader-compiles"
      ]
    },
    {
      "position": 6,
      "actorId": "wgsl-fns",
      "plannedHarnessIds": [
        "wgsl-compilation-suite"
      ]
    },
    {
      "position": 7,
      "actorId": "electronicarts-cpp-ml-intro",
      "plannedHarnessIds": [
        "mnist-webgpu-demo"
      ]
    }
  ],
  "actors": [
    {
      "id": "holoscript-snn-webgpu",
      "name": "HoloScript SNN WebGPU",
      "type": "package",
      "organization": "HoloScript",
      "source": {
        "repositoryUrl": "https://github.com/brianonbased-dev/HoloScript",
        "packagePath": "packages/snn-webgpu",
        "upstreamCommit": "337a39a869a552c814933c587fe65b34a0a2c95d",
        "commitVerifiedAt": "2026-08-08T18:35:06Z",
        "license": {
          "identifier": "MIT",
          "evidenceUrl": "https://github.com/brianonbased-dev/HoloScript/blob/337a39a869a552c814933c587fe65b34a0a2c95d/LICENSE",
          "verifiedAt": "2026-08-08T18:35:06Z"
        }
      },
      "engagementStatus": "measured",
      "evidenceMaturity": "diagnostic",
      "adoptionStage": "validation-workload",
      "promotionStatus": "not-promoted",
      "observations": [
        {
          "id": "seeded-spmv-benchmark",
          "summary": "The package contains a seeded tropical SpMV GPU benchmark with a CPU reference, numeric tolerance, median latency, and p99 latency.",
          "evidenceUrl": "https://github.com/brianonbased-dev/HoloScript/blob/337a39a869a552c814933c587fe65b34a0a2c95d/packages/snn-webgpu/src/__tests__/tropical-spmv-gpu.benchmark.test.ts",
          "observedAt": "2026-08-08T18:35:06Z"
        },
        {
          "id": "determinism-probe",
          "summary": "The package contains repeated-run hash checks and records unresolved cross-device determinism differences.",
          "evidenceUrl": "https://github.com/brianonbased-dev/HoloScript/blob/337a39a869a552c814933c587fe65b34a0a2c95d/packages/snn-webgpu/src/paper/__tests__/LIFDeterminismProbe.test.ts",
          "observedAt": "2026-08-08T18:35:06Z"
        },
        {
          "id": "mock-fallback-risk",
          "summary": "The test setup can install mocks when live WebGPU initialization is unavailable, so a Doe harness must fail closed on provider identity.",
          "evidenceUrl": "https://github.com/brianonbased-dev/HoloScript/blob/337a39a869a552c814933c587fe65b34a0a2c95d/packages/snn-webgpu/src/__tests__/setup.ts",
          "observedAt": "2026-08-08T18:35:06Z"
        }
      ],
      "scoreHistory": [
        {
          "revisionId": "initial-source-review",
          "recordedAt": "2026-08-08T18:35:06Z",
          "reviewer": "codex-research-draft",
          "reviewStatus": "provisional",
          "registryRevision": "1",
          "scoringPolicyVersion": "1.0.0",
          "changedByObservationRefs": [
            "seeded-spmv-benchmark",
            "determinism-probe",
            "mock-fallback-risk"
          ],
          "doeLeverage": {
            "score": 5,
            "reasons": [
              {
                "summary": "Doe can address an observed determinism problem while competing on an existing correctness-gated performance workload.",
                "observationRefs": [
                  "seeded-spmv-benchmark",
                  "determinism-probe"
                ]
              },
              {
                "summary": "Doe receipts can make provider fallback and execution identity explicit.",
                "observationRefs": [
                  "mock-fallback-risk"
                ]
              }
            ]
          },
          "existingCapabilityCoverage": {
            "score": 3,
            "reasons": [
              {
                "summary": "The package owns GPU kernels, Node provider setup, correctness oracles, performance measurement, and determinism probes.",
                "observationRefs": [
                  "seeded-spmv-benchmark",
                  "determinism-probe",
                  "mock-fallback-risk"
                ]
              }
            ]
          }
        },
        {
          "revisionId": "first-harness-review",
          "recordedAt": "2026-08-09T01:08:00Z",
          "reviewer": "codex",
          "reviewStatus": "reviewed",
          "registryRevision": "5",
          "scoringPolicyVersion": "1.0.0",
          "changedByObservationRefs": [
            "seeded-spmv-benchmark",
            "determinism-probe",
            "mock-fallback-risk"
          ],
          "doeLeverage": {
            "score": 5,
            "reasons": [
              {
                "summary": "The reviewed harness confirmed that HoloScript's oracle-backed workload finds concrete Doe correctness defects and retains provider, execution, and output evidence for regression protection.",
                "observationRefs": [
                  "seeded-spmv-benchmark",
                  "mock-fallback-risk"
                ]
              },
              {
                "summary": "The separate upstream determinism probe remains a high-value next workload for Doe receipts and replay.",
                "observationRefs": [
                  "determinism-probe"
                ]
              }
            ]
          },
          "existingCapabilityCoverage": {
            "score": 3,
            "reasons": [
              {
                "summary": "HoloScript continues to own GPU kernels, Node provider setup, correctness oracles, performance measurement, and determinism probes above the runtime provider boundary.",
                "observationRefs": [
                  "seeded-spmv-benchmark",
                  "determinism-probe",
                  "mock-fallback-risk"
                ]
              }
            ]
          }
        }
      ],
      "harnesses": [
        {
          "id": "tropical-spmv",
          "status": "measured",
          "manifestPath": "bench/external-projects/holoscript-snn-webgpu/tropical-spmv.harness.json",
          "proofTargets": [
            "correctness",
            "performance",
            "reliability",
            "diagnosis"
          ],
          "oracle": {
            "status": "reviewed",
            "observationRefs": [
              "seeded-spmv-benchmark"
            ]
          }
        },
        {
          "id": "lif-determinism",
          "status": "proposed",
          "proofTargets": [
            "correctness",
            "determinism",
            "diagnosis"
          ],
          "oracle": {
            "status": "upstream-existing",
            "observationRefs": [
              "determinism-probe"
            ]
          }
        }
      ],
      "reviewedReports": [
        {
          "reportId": "holoscript-tropical-spmv-2026-08-08-diagnostic",
          "path": "reports/ecosystem/holoscript-snn-webgpu/holoscript-tropical-spmv-2026-08-08-diagnostic.json",
          "sha256": "b3e691b403d699bcbebc3b21034cffb1c4fd085bd6e103da7b4fe265b8125369",
          "reviewedAt": "2026-08-08T19:35:30Z",
          "reviewer": "codex"
        },
        {
          "reportId": "holoscript-tropical-spmv-amd-vulkan-2026-08-11-diagnostic",
          "path": "reports/ecosystem/holoscript-snn-webgpu/holoscript-tropical-spmv-amd-vulkan-2026-08-11-diagnostic.json",
          "sha256": "6d1958ff73813aff916e8751d476c7c3fb827542b7381f1cb06de9ed691ea77c",
          "reviewedAt": "2026-08-11T12:30:00Z",
          "reviewer": "codex"
        },
        {
          "reportId": "holoscript-tropical-spmv-runtime-ownership-2026-08-15-diagnostic",
          "path": "reports/ecosystem/holoscript-snn-webgpu/holoscript-tropical-spmv-runtime-ownership-2026-08-15-diagnostic.json",
          "sha256": "f79aca867f1c9bb704784bba7196154452c9d64b942bd90a2567581541a7add7",
          "reviewedAt": "2026-08-15T16:10:00Z",
          "reviewer": "codex"
        }
      ],
      "failureRecords": [
        "bench/external-projects/holoscript-snn-webgpu/failures/entry-point-scoped-auto-layout.failure.json",
        "bench/external-projects/holoscript-snn-webgpu/failures/labeled-compute-pass-semantics.failure.json"
      ],
      "claimIndexRefs": [],
      "lastReviewedAt": "2026-08-15T16:10:00Z"
    },
    {
      "id": "electronicarts-gigi",
      "name": "Gigi",
      "type": "project",
      "organization": "Electronic Arts",
      "source": {
        "repositoryUrl": "https://github.com/electronicarts/gigi",
        "upstreamCommit": "401386cfd7c6e39e549d939e44d99bd5b49cd14d",
        "commitVerifiedAt": "2026-08-08T18:35:06Z",
        "license": {
          "identifier": "LicenseRef-EA-BSD-3-Clause-With-Marks",
          "evidenceUrl": "https://github.com/electronicarts/gigi/blob/401386cfd7c6e39e549d939e44d99bd5b49cd14d/LICENSE.txt",
          "verifiedAt": "2026-08-08T18:35:06Z"
        }
      },
      "engagementStatus": "measured",
      "evidenceMaturity": "diagnostic",
      "adoptionStage": "validation-workload",
      "promotionStatus": "not-promoted",
      "observations": [
        {
          "id": "generated-webgpu-suite",